{
  "schema_version": "1.0",
  "record_type": "feed_manifest",
  "provider": "news_feed",
  "captured_at_utc": "2026-09-03T02:00:00Z",
  "pagination_complete": true,
  "raw_manifest_sha256": "sha256:aaaaaaaaaaaaaaaaaaaaaaaaaaaaaaaaaaaaaaaaaaaaaaaaaaaaaaaaaaaaaaaa",
  "coverage": [
    {
      "security_id": {"scheme": "FIGI", "value": "BBG000B9XRY4"},
      "ticker_at_event": "AAPL",
      "start_at_utc": "2026-07-01T00:00:00Z",
      "end_at_utc": "2026-09-01T00:00:00Z",
      "status": "complete"
    }
  ]
}
